1	book a highly rated restaurant.
1	i'm looking to book a seat at a bakery that serves coleslaw at 19:44:58.
1	book a restaurant this year for party of 2
1	i need a reservation for 6 pm. with a party of 10 at sand lake
1	i want to book coney i-lander for 10 people.
1	i need a reservation for my teens and i six months from now in tennessee
1	book a table for seven people at six at the restaurant
1	lets go and take elsa and i to westhampton beach in 1 hour to the american chinese cuisine at the tea house
1	book a table at an oyster bar that serves apple butter on jul. 10th, 2028
1	book a table for me and belinda serving minestra in a bar
1	i need fast food for nine within the same area as bowers that has a pool nearby on 4/17/2033
1	book a table for 2 people at a restaurant with parking
1	make me a reservation in tn somewhere nearby for a party of 4
1	i'm looking to book a table at a place in newton falls, prefereably within the same area that has space for 6
1	i want to book a restaurant not far from our college.
1	book a tavern in colorado for two
1	book a table for ten people in eucalyptus hills.
1	book a reservation for 2 at fashion cafe in diwali
1	book a table for six in beech creek
1	i need to reserve two seats to eat at in salina, alabama.
1	book a table for a party of 7
1	book a reservation for the training table on mar. thirteenth, 2026
1	reserve a table for one at a top-rated restaurant nearby that serves goiano for this month in md
1	on jun. the sixteenth, 2032 i'd like to go to dillard house in putnam hall
1	book a reservation for a restaurant serving burger in malaysia
1	i need a table at a cafeteria for a party of 6 in al
1	book a restaurant reservation for my gf and i within walking distance of sondra's university
1	i need a reservation for chapter one in west odessa for a party of one
1	i want to make a reservation at a sushi restaurant
1	anything close to smith-9th st that can seat two people about one minute from now ?
1	i need a table for five at childs restaurants in brunei.
1	rebekah taylor and marcie need reservations at the clink in senegal.
1	i'm looking to book a reservation in aruba at a place nearby.
1	lets go to a bistro in sd
1	book a table in connecticut in robinette for one second from now
1	i need a table for 7 people at a bar that specialises in being a protein bar.
1	book a table for 9 people at a delicatessen for april the twenty-eighth, 2018.
1	i need to book a restaurant in sunnybrook for 7
1	i need a reservation for a party of three, maybe a gastropub that sells steak.
1	i need to book a reservation in searsport at eleven am
1	i need to find a restaurant in pw.
1	book me an indoor pub in jersey
1	i'd like to eat at an oyster bar with a pool
1	make me a reservation at a popular place that serves udupi at a restaurant
1	book a spot at a highly rated tea house in manadonese
1	book a spot for 4 at a restaurant in shambaugh md
1	me and robin need reservations for somewhere in palau
1	i want to book an osteria for 9 in gabon that serves donuts
1	i have four people needing a restaurant reservation.
1	i need a bakery that serves beef manhattan at midnight for nine
1	book a restaurant for four on october 9 in maine
1	i want to bring six of us to a bistro in town that serves hot chicken sandwich that is within the same area.
1	please call and reserve seating for march 6 at a diner in kyrgyzstan
1	i need to book a popular pastelaria restaurant in svalbard and jan mayen for a party of eight
1	book a table for seven in a pub in iraq which offers gluten free food about 141 days from now.
1	i need to book a restaurant in fork mountain, sc for valarie, mari and i
1	can you get a table at the triple door in district of columbia for me and deborah vasquez
1	i need a reservation in 1 second in atlas with a party of nine
1	i need a reservation, looking for a place with pool at midnight in a pub.
1	book a popular food truck in kentucky
1	i want to find a restaurant that has a table for two at 5 am
1	book me a pizzeria that serves oreo for eight
1	i need a reservation for a highly rated goiano restaurant in ar
1	book for crepes at a restaurant in sint maarten
1	find a table at a restaurant in bynum ca at 09:59 pm
1	book a bar with mediterranean food for three people
1	i'd like a table at the san francisco brewing company in puerto rico at noon
1	book a spot at savoy hotel and grill that is neighboring wisconsin
1	book a table at dillard house in exell, ia
1	book a taverna in wisconsin for 22:54.
1	book reservations at a tea house in lodi with my granddaughter and i
1	i want to book a cafeteria in el reno that serves javanese
1	book now at a bakery at a spa
1	i need a table somewhere in culver city wa
1	i want to book a restaurant in botswana for four people.
1	i need to book a table at brasserie for 10 that is highly rated in kentucky
1	book a table for nine pm at a pub in ma
1	book a restaurant around thompson
1	i need reservations at khedive palace that's close in town.
1	i need a reservation for blue ribbon barbecue far from ny for a party of 10
1	book a spa in pizzeria on november 24, 2036
1	book a highly rated bar in burkina for georgia and i
1	need a booking for 6 in ok for the city of boonton
1	book a popular joint in ocean gate for seven people at elevenses.
1	i would like to book a fry sauce bar for jul. 3, 2019
1	book a restaurant in the dominican republic in one minute for a party of eight
1	book a restaurant in donnelly
1	book a spot for 3 in mt
1	book a reservation for a gastropub serving liver and onions
1	i need a table in east timor for a party of nine at 5 north st
1	please book me a table for next week at a top-rated restaurant
1	i want top-rated veneto cuisine at a restaurant in antietam for 2.
1	book a restaurant for four people in wylliesburg.
1	book a spot for six at a restaurant that serves fish and chips
1	i'm in tuolumne city and want fast food for a party of eight
1	book a table in sterling run for two with a pool and food court
1	book a reservation for can fabes nearby namibia
1	on june 27, 2026 i'd like to go to a delaware gastropub
1	need a table for rita, antoinette and i
1	make a reservation for hillary, dina chavez and alexis
1	book me a table for five at the top-rated morocco restaurant.
1	find a reservation for three at a top-rated restaurant
1	book a restaurant in satanta that has highly rated northeastern for 10
1	book a reservation for city tavern in long bridge
1	book a table for pearl and verna slated ash wednesday in gabon.
1	book a food truck that is highly rated in honduras
1	find me a table for 8 somewhee in hollenberg in nine weeks
1	book a table at laurie beechman theatre for a party of 4 in utah
1	i would like to book at clinton street baking company & restaurant in brookneal.
1	book a table for me and my step uncle in malta at a cafeteria
1	i want to eat somewhere that is faraway from iowa.
1	2 of us want to eat at a restaurant that serves meatballs in vt
1	book the space aliens grill & bar in hord wy for feb. the twenty-seventh.
1	book a spot for 3 in egypt at five
1	please book a restaurant for party of 1 in seeley lake on july the fourteenth, 2022.
1	i want to book a cafeteria for 4 that has meze
1	need a table for nine in east prairie la
1	book me a restaurant for 4 members at beaman federated states of micronesia in one minute
1	need to book a reservtion for a restaurant in maryland for me and my half sister
1	i'd like to eat at a pho restaurant in vt
1	i want to make a reservation for one at a sushi restaurant in brucetown
1	table for nine at an internet pub
1	i want to book a bar neighboring our apartment.
1	book a table not far in wy at a gastropub with internet for me, jenny and antoinette in one week
1	book sot for one at restaurant with wifi
1	i need to book a table at the star inn that's within walking distance from my place in ashland
1	i need to book a restaurant for 6 people.
1	book me a reservation for a bar that serves lobster roll in or
1	i want to book a restaurant with creamed eggs on toast on kansas day within walking distance of british indian ocean territory
1	i want a table to seat 10 at a close-by to ottumwa that serves osteria and ranch dressing.
1	i would like to book the best food court with persian food within the same area as ok for my ex husband and i
1	book a table at a bar in argentina.
1	book a spot for nine at a top-rated brasserie that has swiss within the same area of new york
1	book a table this evening in saint vincent and the grenadines at a gastropub
1	book a table in hallwood for one for supper
1	i want to eat panisses the nearby cafeteria in naytahwaush
1	book a table at a osteria type restaurant in sd
1	book a table for kristina and teresa in 1 second.
1	i want to book the commons restaurant for five on dec. the eighth
1	book the cityzen for six people.
1	please get me seating at the tavern in red lick, michigan
1	need to book a table at a fast food restaurant for a party of nine on november seventeenth, 2019
1	i want to eat at a bakery with deidre and rosa in jersey.
1	book a restaurant for ten people 1 second from now.
1	book reservations for ava gonzales, raquel brown and i on jul. 6, 2040 in hainesville at a restaurant
1	i need to get seats for me and my ex wife to eat in egypt.
1	book the lake house for me and carmella
1	find a reservation at a brasserie restaurant nearby sc for a party of ten
1	antoinette and i want to eat at an oyster bar that serves pizzette in south duxbury me
1	book a restaurant in medford lakes on sep. 8, 2033 for essie, tonya and i
1	book a restaurant for four in burundi
1	i'd like a table for my teenager and i at the washington, d.c. jewish community center
1	book a table for doris and i in new tulsa
1	book a reservation at a restaurant with me, matilda and deana
1	reserve a place to eat on march fifteenth in china within the same area.
1	i'd like a table for three at black rapids roadhouse on february 24th, 2039
1	get me a table at a bar which has a spa.
1	please make reservations for a bar close-by in lake alfred.
1	i need a reservation for roscoff restaurant in valley mills
1	i need a table at a brasserie in belgium
1	i want to book at a pub with parking in cuba.
1	book a table for 4 at fish express
1	i'd like to eat at a top-rated place on nov. the twenty-sixth in the food court, i need reservations for 7 in the city of kane or somewhere near there.
1	book me a table for seven in neighboring france.
1	book in falkland islands at atomic cafe
1	i want to take four friends to the pub for some tuna casserole
1	i need a reservation in decaturville for six people.
1	book me a reservation for eight for the top-rated bakery eleven hours from now in mango
1	book a spot for ten at a restaurant with a spa in u.s. minor outlying islands
1	book a reservation for seven people at a highly rated restaurant that serves moroccan food in east greenville
1	book the light horse tavern for 4 people.
1	book a table in ut at kearney for 6
1	book a table at a restaurant in lucerne valley that serves chicken nugget
1	me and deanna want to book a restaurant in malawi
1	book a food truck that serves tarte for tanisha, lorena and juliana.
1	christie, concepcion and i want to eat trattoria at a brasserie in johnston now
1	book in one hour within walking distance of a restaurant downtown
1	i need to book a top-rated steakhouse this autumn  for 1 around azerbaijan
1	book in romania for christian and susana at david carpenter house
1	book in ukraine at a highly rated restaurant
1	let me get reservations at a place neighboring indonesia on august the nineteenth.
1	i'd like to book a reservation for next spring for nine people at shore club.
1	book the chapter one in bosnia and herzegovina for patti, hester richardson and camille
1	book me a restaurant ten minutes from now
1	i need a reservation for a tea house in maple glen for four people
1	i'd like to eat at ten pm. anywhere neighboring to our house
1	book a table for seven people at a restaurant which has internet.
1	book a table for 6 at a restaurant in pershing square, manhattan at two am
1	book a restaurant in nebraska on january 25, 2034 for me and my mommy.
1	book a restaurant table at the food court in the spa sixteen hours from now
1	book me a table for one at blue ribbon barbecue
1	book a highly rated food court for 2 people on jul. 4th.
1	locate a bakery in rockport, federated states of micronesia that serves olives
1	book a table for my great grandfather and i at a place in booker, ak.
1	book a table at anstruther fish bar in fm
1	please make a reservation at ten at a bakery which serves burrito.
1	book the labworth cafã© in ethiopia for six people.
1	i have a party of 7 in east timor
1	i need a table for 1 minute from now at any pub for five around in that also serves fisn'n chips.
1	book a best tavern for nine
1	me and aisha and craving cordon bleu and need to book a table at a brasserie.
1	evangeline and petra cooper want to go to a restaurant in 9 years
1	table for one somewhere in palco
1	i need to book a restaurant at four o'clock for 4
1	lets go to a steakhouse before we go to the pool
1	book a table for iris, ina and heidi around 9 pm.
1	i need a reservation in pitcairn islands for any restaurant  joint
1	book something for me and my wife at a restaurant in four weeks
1	need a table in serbia and montenegro on apr. 16 for a party of seven
1	book a steakhouse with a spa for seven people.
1	i need seats for six at a vegan bar in london borough of enfield or the same distant in one second
1	book a table at a diner which serves thousand island dressing in ivory coast.
1	i need a booking for seven people at metropolitan museum of art.
1	book a reservation for four at the best brasserie in venezuela
1	book a table for 1 person at a popular brasserie in jansen that serves english food
1	i need a reservation for eight for a brasserie that serves spanish rice
1	book reservations at a restaurant in ne for 4 people on apr. 2, 2021
1	book a gratin serving tea house in bushkill
1	book a restaurant that serves bouchã©e for midnight.
1	book a restaurant for 7 people.
1	party of two for a food truck on december 22 that serves chicken french in bolivia
1	book a spot for marlene, jordan and i on oct. the 6th
1	book a restaurant that serves trottole in tillicum
1	i'd like to book the best restaurant in as.
1	book a spot for 10 in the same area  of inwood - 207th st
1	i need to book a restaurant in burkettsville in 2 years  for rhoda adams, roxanne and i
1	need a table at a fast food restaurant for me and my kids in brusly landing
1	i need a table for nine in atlas in 1 second
1	book a restaurant distant from downtown.
1	i want to bring four people to a place that's close to downtown that serves churrascaria cuisine.
1	in delanson 1 hour from now reserve a table for four
1	find me a table at a delicatessen in urbanette that serves rabbit pie
1	book a restaurant in wi at 13:22:34 for 9 people.
1	please make reservations for three at a kosher taverna nearby our secondary residence
1	book a restaurant in indiana for me, violet and dianne.
1	book a restaurant close to grant av
1	book reservation for 2 people tomorrow in whitewater
1	i need a table for 8 people at a restaurant in district of columbia.
1	book a table for ten people
1	book a restaurant for 9 at 00:37 pm
1	book a restaurant in botswana for seven people.
1	book georgetown cupcake in keller for tea time.
1	book a restaurant for marcella, erma and leanne rivera.
1	i would like to make a reservation for 2 for brunch.
1	book a table for me and my crew scheduled for 10:47:15 pm in il.
1	i'd like to go to the popular bistro in oh
1	please book a bar type goiano room accommodate for 2 members 1 second from now in pr
1	i'm looking to get a seat at a brasserie in togo.
1	book me a table at a tartinery restaurant not far from my home in elk rapids.
1	book a brasserie at turtle creek neighboring on march sixth, 2038 for eight
1	book a maharashtrian restaurant please.
1	book a table for five in unalaska this month.
1	my party of 3 would really like to eat baba au rhum at a brasserie, could you help?
1	i want to book a restaurant now in ludlow for eight
1	i want to book a pub in ms that serves festoni
1	book a cafe in romania
1	i want to take my parents and i to eat some romagna at a brasserie in north dakota
1	book a table for 1, 1 second from now in adelaide
1	in one hundred twenty seven days i'd like to eat at a pizzeria in north lima
1	book a brasserie in cuney for seven people.
1	book me a table for seven in co-operative block building, nd.
1	i'd like to eat surf and turf in one minute at a bar
1	i want to take my mom and i to the tea house
1	i want to book a highly rated pizzeria in the same area as tia's house
1	i need a table at the middle east in mn for a party of 6
1	book me a restaurant at sint maarten on sun.
1	book a restaurant in three points
1	i want a table for 2 at a portugal restaurant
1	i'd like to eat at an internet restaurant with a party of four
1	i would like to book a bistro for 7
1	i'd like to eat at a restaurant in md with a party of 8
1	find a reservation for 2 at a restaurant for pizza
1	i want to book a restaurant in bosnia and herzegovina.
1	need a booking for a party of five at a restaurant in french polynesia
1	book reservation at the big chill cafe in ar for 10 people
1	make me reservations for a highly rated restaurant.
1	book a restaurant for my baby and i in delaware
1	book a table at the top-rated taverna in north korea.
1	book reservations at a restaurant in jersey for six people next october
1	book a cafe table for one that has internet access
1	i'd like to eat at a restaurant far from grantsburg
1	book a table at a tavern in albania for annette, darlene and barbara james for ten am
1	book a restaurant in swaziland in 1 hour.
1	book me a reservation for an osteria campanian on jun. the 7th, 2022
1	book a reservation for me and my step sister in nebraska in two seconds
1	book the coon chicken inn in baker city for 4 people.
1	book a restaurant in french southern territories on dec. the fifth, 2026 for two
1	book me a reservation for 10 in oman
1	book a restaurant for nine in south sudan.
1	book reservations at a restaurant in iron springs
1	please make me reservations somewhere for eight people in foley, nv
1	table for 5 am. at bakerâs keyboard lounge
1	i want to eat mezes at the pub for 1 at four pm
1	i'm looking for a table of eight at the alley.
1	i need a table for five in viroqua
1	book a russian restaurant for 4 people.
1	book a bakery that serves souvlaki for tomorrow.
1	find me a table at a javanese brasserie
1	we want to eat at a brasserie with sicilian food in nebraska
1	book a table for now for 4 for an oyster bar
1	i need a table for 2 on feb. 18 at main deli steak house
1	i'd like to get 4 seats at a restaurant.
1	asiate restaurant in sturgeon for 7
1	restaurant in zambia that is close for a party of 10
1	restaurant that is brasserie for  8 and has wifi
1	i want eat at the best spanish restaurant in the georgia area that is within walking distance for me and my nephew at noon
1	book rosalie stewart and evelyn at a restaurant
1	book a table for 0 pm in fayette for rachael morris and shannon near there
1	i need a table for one
1	book a spot for nona gray, myrtle and alison at a top-rated brasserie that is distant from wilson av on nov. the 4th, 2030 that serves ouzeri
1	book the ballylickey house for 7/16/2027.
1	book an outdoor place for 11/1/2033 in town within walking distance of a brasserie for nine
1	i need a reservation for a restaurant that serves cupcakes in oh
1	i'd like a table for 3 at a tavern in the vatican
1	i want a table for 5 next fall om curacao
1	book a table at a restaurant for 10/24/2028 for me and lauren
1	need a table at uncommon grounds coffeehouse at eleven for nine
1	i need a reservation for the french laundry in oh for six
1	i'd like a table for two at a brasserie in sã£o tomã© and prã­ncipe
1	reservea  table for five people on september second in gabon.
1	book reservations at a nearby restaurant in montenegro for four people
1	book me a reservation for the brazen head in hecker
1	book a molecular gastronomy serving restaurant on march the 20th
1	book a spot for seven at a japanese joint in grandview heights
1	book me a tibetan restaurant for my boss and i.
1	book a bar close by with a smoking room in ma
1	can you make reservations for 1 person in il
1	book the dunbrody country house hotel in ne for 8 people.
1	find a table for one at a popular churrascaria for three weeks from now
1	make me a reservation at illinois central railroad freight depot in singapore with vickie rodriguez, lila reyes and ruby
1	i'd like a table for natasha, bettye and kimberley at a coffeehouse with a smoking room
1	book tortano serving brasserie for me, isabella and carly in kuwait
1	book me a table for 2 in 6 years  at a restaurant that serves potã©e
1	make a reservation far away at the spotted pig in sd.
1	i want to go to an outdoor cafe in pioneer day
1	i want to book a table for me and my boss at glassy junction in turkey.
1	i need to book a pub in cammack village wyoming for a party of seven
1	book something for darlene, tessa and maxine at a restaurant for 09:58:27
1	make me a reservation at taverna in a smoking room
1	casey and i will be in kentucky for food
1	book a spot for 1 at a bakery with crab cake not far from new jersey
1	book a table for 7 at a popular bistro distant from kremmling
1	book a table for 5 at a pub during my macedonia trip that serves czech food.
1	book me seating at a popular joint for sep. the 10th
1	i'd like a table for six at the bakery in as
1	book a restaurant in town not far from here for me and my mother in law.
1	i need reservations for a party of 8 within the same area at 01:48:35 at a restaurant in armenia that serves tuscan cuisine.
1	book some indonesian food truck food that is not far for a party of 8 in ia
1	make a reservation at a diner which serves chowder in mt for august the 17th, 2024.
1	i need a table at light horse tavern in city of the dalles nh for kathleen, brianna and i
1	i need seats for five at a place five and a half months from now
1	book a pub for eight people in the pitcairn islands.
1	i need a table for a party of 2 at co-operative block building in old glory
1	i want jean-georges for a party of 2
1	reserve me seating midday at bear hotel
1	book a restaurant near the city of wakefield for 5 people.
1	book a table for two in oklahoma
1	book me a restaurant in guadeloupe
1	find me a table for 8 people at a nearby al restaurant one minute from now.
1	book in west palm beach for glenda, lois and tamra at a nearby restaurant serving puglia
1	i need a table at a restaurant in ireland serving kouglof
1	find me a bar in eagle pass, vermont that serves noodle dishes, that will take reservations for 2/21/2021.
1	book a table for ida, monica and etta at cold spring tavern in md
1	book reservations at a highly rated bar on 11/23/2031
1	book a stuffed ham serving pizzeria in independence corner
1	book a brasserie with parking for 1
1	i want to book a table at a nearby restaurant in andorra for me and my kids.
1	i really need a top-rated restaurant that can seat 3 people in 1 minute from now.
1	book a churrascaria restaurant that serves spring rolls for one person.
1	book reservations at a restaurant for me and my ex husband in west virginia
1	make me a reservation for a party of 2
1	book a diner for 1 in green isle
1	book fast food that is highly rated
1	me and katharine would like to go eat at jan. 22nd in ia
1	book main deli steak house on february 13 in serbia and montenegro
1	i want tables for 6 at a kosher steakhouse around kosovo
1	i need to book a restaurant that serves sundanese in bonaire for 7
1	book a taverna that serves bengali for six at five
1	i'm looking to book a table at a gastropub that serves vegetarian for me and my team
1	please book me a table at a food court faraway from saint kitts and nevis.
1	i want to book a table at the commons restaurant in south pekin new hampshire for a party of 10 on january the 24th
1	book a restaurant in bouchon for 1
1	book a restaurant for 5
1	book a spot at a crab restaurant
1	book a reservation at a restaurant nearby their airbnb
1	book a reservation for louisiana fried chicken this winter in taiwan
1	book a restaurant in hi
1	i want to book a bar in bonaparte palau.
1	can you make reservations at a tea house that serves fettucine?
1	i want to book meriton grand hotel tallinn in new jersey for four people.
1	i want a table for eight in yakima rhode island
1	book a reservation for a restaurant serving wontons for ten people in leopold
1	book at tavern on the green for in 1 minute in co
1	book a reservation for a party of four within the same area of districts of sweden
1	i need to reserve a table for me and my mom at the nearest restaurant in the state of mh.
1	set an reservation for a party of eight at the bar on 8/8/2039
1	book me a table for two in oakes.
1	i need to book a table for 6 people at montreal pool room in croatia.
1	reserve a table in top of the mark lambertville, vermont.
1	i'm going to herkimer and want some liver and onions and i need a table for bessie, antonia and lisa at a cafe around 10 am
1	book a restaurant for november 19
1	reserve a table at a restaurant with wifi in france
1	can you make reservations for two people somewhere distant from sutphin blvd
1	i need a table at somewhere within walking distance of nv on november the 24th, 2027
1	i need to book a tropã©zienne restaurant six hours from now
1	i need a table in your position at churrascaria for a hot dog in the same area
1	book a table at crown candy kitchen for lacy and i
1	book at table at a brasserie which serves padangnese food.
1	i need to book a table for five at the crooked house of windsor.
1	make a reservation for 9 at a brasserie with parking
1	book a table today at a steakhouse for eight that serves sashimi
