3	play dj drama from the 1976
3	play my tribute by billy cox
3	play the playlist, hardstyle, baby.
3	play me a sound track by bert mccracken on zvooq
3	play some music from the fourties.
3	play music on itunes.
3	i want to hear a sandra ep
3	play theme by yanni on vimeo
3	play fourties tunes
3	play a 2004 song by eliel on zvooq.
3	play some music on vimeo
3	play the newest music by gladys knight
3	play hora din moldova by yamazaki maso
3	play the album winner takes all by takuro with last fm
3	play the best ballad by the rascals.
3	play me the track mama liked the roses
3	play eighties
3	play a 2014 theme from greg pattillo
3	play some music from roberto carlos
3	play the concert from philip oakey 1973 concert on netflix
3	play some music from 1995
3	play kaori mochida's most popular music on google music.
3	play a chaos of desire from dan snaith
3	play music by country dick montana.
3	play chant from the nineties with last fm
3	play a top 5 song from wally bastian on google music
3	play white noise.
3	play ep from quasimoto from the nineties
3	play a 1988 soundtrack
3	play a popular sound track by joe pass on itunes.
3	play something from the jonathon lee movement
3	play james moody ballad
3	i want to listen to some music from 2003 on pandora from them
3	play a top 50  tune from the twenties by willi williams
3	play fifties track music
3	play theme music from 2011.
3	play music by billy powell
3	play one good reason by tommy flanagan on itunes
3	play some fun-punk
3	play me a song by dj paul elstak in 1988 on zvooq
3	play hasan saltik from 2004
3	i want to hear popular music from martin lopez
3	play a sudden rainstorm playlist.
3	play wendy james from the fifties
3	use itunes to play music
3	play a paul davis melody
3	play lorenzo palacios quispe
3	put on vimeo and play kacapi suling
3	play a soundtrack by sarah geronimo on google music
3	play me a song from 1976 by bennie moten
3	i want to hear eighties music by noko on deezer.
3	play some glenn miller.
3	can i hear a song by david hodges?
3	play the new retro playlist on netflix.
3	play some p. j. proby
3	play soundtrack by armand van helden
3	play the lamentation of cloris
3	i want to hear the new latin pop rising list
3	please play some music from the seventies movement
3	play signe anderson chant music that is newest
3	play richard thompson from the thirties song book
3	play funtime activity
3	play me a song from luxury liner
3	i want to hear de eerste keer from paul caiafa  off of google music
3	play a sixties song.
3	i want to hear some twenties music off of deezer
3	play some movement from 1959 on deezer.
3	play songs by queen
3	please play good music by will oldham.
3	play a song from the thirties on zvooq
3	play vanlose stairway by janove ottesen
3	play me the last 1980 record by brenda kahn
3	play music from the top-5 from artist kenia arias
3	lets hear some 2009 music
3	play some bass music.
3	play furusato on google music.
3	play party anthems
3	use iheart radio to play eighties music from hugh masekela.
3	play a symphony from bob hardy please
3	play some eighties music.
3	play a 1964 track from shahram nazeri on pandora.
3	sort to the last song on playlist from 1983 a chant by mark oliver everett
3	play a new symphony by perfecto de castro on lastfm
3	play some music from the thirties.
3	play some matthew sweet music from around 1996 on spotify
3	open lastfm  play top hits of simon webbe
3	play 1981 music on last fm
3	play a track from 1959.
3	play chant music by big dee irwin.
3	play me gil parris's a cup of coffee, a sandwich and you
3	play pura vida.
3	play a top fifty ballad by linda strawberry on google music
3	use spotify to play greatest songs from kailash kher
3	play the newest melody by cisco adler on pandora
3	use service vimeo to play music from the artist mick track now we are 5
3	open youtube and play renaldo lapuz record from the eighties
3	play some good amber gristak on lastfm
3	play some synthpop
3	play music from my relentless playlist
3	plpay my disco fever playlist.
3	play valerij kipelov on vimeo
3	can you play the change is made on netflix
3	play some robbie merrill.
3	play me a song from the twenties by randy bachman
3	i need to hear some r&b music off of iheart
3	play some dance music.
3	play new music from liang wern fook
3	listen to pmd symphony
3	play by the sleepy lagoon by greg kurstin
3	i want to listen to some saori atsumi from the twenties on deezer
3	play some gangsta music
3	play the eternal by juju mob on vimeo.
3	play me a mario vazquez movement
3	play music on lastfm
3	play eve
3	play music from 2011.
3	play some psychedelic rock.
3	play top 100 indie tracks on spotify on lastfm
3	play an eighties track
3	can you play me some eighties music by adele
3	play oliver cheatham's symphony from the thirties.
3	play chant music by ira losco on iheart.
3	play me the most popular lillian hardin song on itunes
3	play the red room sessions from chris cunningham
3	can i use lastfm to listen to twilight time by dj khalil?
3	i want to listen to roger daltrey from the sixties on slacker
3	play music from tommy ridgley.
3	play all of your toys by chris ledoux
3	play music by fidel nadal sorted by newest.
3	play shaina magdayao's music on iheart
3	i need to hear a thirties soundtrack
3	play dave wyndorf album
3	play me a song by linn berggren from spotify
3	play me something by funtwo
3	play some the lady is a tramp from timour moutsouraev
3	play pandora tracks by akhtar sadmani
3	please play some music from 1996
3	use the service lastfm to play music by the artist ai kago
3	can you play a song by ken
3	play music using last fm
3	play some kyle ward from the seventies
3	play bald by kaskade.
3	play me some music on deezer
3	play my futuros hits playlist on spotify.
3	play strength of street knowledge on groove shark
3	use pandora to play korean osts
3	play some gospel music.
3	play satire
3	play the top 20 ep from the fifties by john bundrick.
3	play alfredo zitarrosa on spotify.
3	play me some terror music
3	play music from 2010 by jason donovan
3	play me something on last fm
3	play giovanni battista guadagnini's 1982 tracks.
3	play some rumba africana.
3	play greg raposo songs from the thirties
3	play a top-five song by pete candoli.
3	play iheart
3	play the symphony by tetsuya ogawa from 1953
3	can you play me some pop-folk music
3	play that new song from 1970
3	play some space music on google music
3	play a song by juanes on last fm
3	play salmonella dub dvd by mario rubalcaba on vimeo
3	play some music from 1958 on deezer.
3	i want to hear some of david gilmour's music from 1973
3	play music from the playlist late night jazz
3	play the song victim of changes from hawkshaw hawkins on spotify
3	play the music from the playlist get lit
3	play bra vibrationer by dean
3	play music from the playlist get your mind right
3	play talking to the universe on itunes
3	i want to hear the album insult to injury by narayana tirtha.
3	play latest shaggy music
3	play slacker radio.
3	will you play a ballad from mahalaxmi iyer
3	use spotify to play nina persson from 1962
3	i want toi hear some pop punk perfection í ¼í½ off of deezer
3	start up my independent music monday playlist.
3	play that would be something by eden ahbez
3	please play every woman in me
3	play some ven a mi
3	please play some fourties music on spotify
3	play dj cameo on itunes.
3	play some gotye
3	play this is colour by panda bear
3	play songs by cheryl wheeler
3	play the most popular song from chae yeon off of spotify
3	please play me something by new wave of american heavy metal
3	play deezer
3	play me the best charles neidich song
3	i want to hear the sound track to mary macgregor new songs on iheart
3	play music on the playlist electronic gaming
3	i want to hear some bill black chant music
3	play some thirties music on netflix.
3	play some eighties by amirbai karnataki
3	open youtube and play connie francis sings spanish and latin american favorites from yukiko iwai
3	play the ricky wilson album spectral dusk
3	play red barchetta by blind lemon jefferson.
3	play the track r u professional by roberto carlos braga
3	play drive playlist
3	play regulateâ¦g funk era by artist iouri bachmet on groove shark
3	play music from itunes for ric grech
3	play some music on lastfm.
3	play the fool on the hill by khwaja ghulam farid
3	play the best songs of 2016
3	play something by chris knight
3	wish to hear a concerto by diplo from 1952
3	play songs from youtube
3	play an album from the fourties, new first.
3	play chantal kreviazuk, sister ray
3	play isaac hayes on pandora from love, sweat and beer ep
3	play only hope by graham bonnet
3	play some avantgarde music on netflix.
3	play gothic music
3	i want to hear song for adam
3	play the playlist feel good dinner.
3	play the top track by claudja barry on last fm
3	play some iris dement's theme based 2015 music on lastfm
3	play the latest ballad by september
3	play fifties music
3	play songs by sarah harding
3	play maggot brain by albano carrisi
3	play a jack lawrence concerto
3	i want to hear the top tim madison
3	play the 1991 soundtrack from ian mcdonald
3	play the best songs by jes brieden
3	play me a song by kevin cadogan
3	play something from my songs for you, not your parents playlist
3	play making out by alexander rosenbaum off google music.
3	play rocket queen on itunes
3	please play a song by everlast
3	play me some chant from the last half of the sixties
3	play music by paul mccartney
3	play some krzysztof penderecki on last fm
3	play easy listening
3	play robert stoddard from 1988
3	play gloria on last fm
3	play some movement by dj spinna
3	play lily, rosemary and the jack of hearts by chris goss
3	play zvooq latest track by peter appleyard
3	play brenda kahn's rushall station.
3	play the top five songs by isaac hayes
3	play some music from the thirties.
3	play 2011 music
3	i want to hear sebastian's songs from the thirties on youtube
3	play top 20 from frank farian
3	play some music using slacker
3	play some psychadelic music.
3	play some geir jenssen.
3	start playing my disney playlist.
3	i want to hear a gucci mane song from last fm from 2002
3	play me a 2003 song by charles neidich
3	i want to hear some songs from the twenties
3	i'd like to hear chant songs from nineties
3	can you play the newest record from 1966 by tony lee
3	please play kabhi jo baadal barse by ruth lorenzo
3	play a record from 2015
3	use the service zvooq to play top-10 by artist coolio
3	play thirties symphony music from nigga on iheart
3	play a sound track by tom thacker
3	play some laurie anderson.
3	open last fm and play the top song from daniel lee chee hun
3	play some twenties music on iheart
3	play popular eighties record
3	play the track grow old with me by artist chloe rose lattanzi
3	on deezer play fourties tunes by jona bechtolt and a ballad
3	play kings of the wild frontier by andrea bocelli
3	play an album from 1987.
3	play music from 1960
3	play a movement from the nineties
3	play bob hilliard top-twenty music
3	play a seventies soundtrack by steve walsh on groove shark
3	use deezer service to play opera
3	play zvooq
3	i want to hear techno-industrial music.
3	play the top song by amon amarth on groove shark
3	play julie driscoll
3	play something from the twenties
3	play the view from the afternoon by malese jow on last fm
3	play songs by sammy fain
3	play music from the year 1964
3	play the heinz strobl ep from 2016 on groove shark
3	play me leonid soybelman on vimeo.
3	play a song from my workout playlist on groove shark
3	play some alte kameraden music
3	play the music hands up
3	play some twenties theme music on google music.
3	play a fifties album on itunes.
3	play genre opera
3	play shadowplay by dana on deezer.
3	play music on deezer by imogen heap
3	find a top fifty zahir howaida concerto from the seventies
3	play the newest twenties melody.
3	i want to hear box of rain by skeets mcdonald
3	please play casino boogie
3	i want to hear a full album on youtube by jem godfrey
3	play an asha bhosle song from around 1964
3	play music from the twenties.
3	play something by louisiana blues
3	play new ian mclagan
3	play music on itunes
3	i want to hear ding dong bell on groove shark
3	play fifties music on slacker.
3	play before i grew up to love you by wafah dufour
3	play a jim mullen ep from the sixties
3	play some good music from 2012.
3	play the greatest soundtrack by nhat son on last fm.
3	play the top hits of 2016
3	play fight on, state.
3	use pandora to play music from maki onaga from the album made in the nineties
3	play the top five cemil bey songs
3	play opera music on google music
3	play music by francis healy
3	play a track from the thirties
3	play music on spotify.
3	play newest soundtrack from 2008
3	play itunes  songs by gerard way
3	play cherry pink by trapp mendoza on iheart
3	play rei momo newest album
3	i want to hear a track by ryohei yamamoto on vimeo
3	start up my nostalgic playlist.
3	play some papoose from 2003 on youtube
3	use deezer to play music by kimberley walsh
3	play punk rock music
3	play something by louis nelson delisle.
3	play 1962 music on netflix
3	play a song by david silveria from 2002 on zvooq.
3	play the 2014 album from la lupe
3	play revival music.
3	i want to hear opera on netflix
3	play the song si no te hubiera conocido by haidar salim
3	start up my pachangueo total playlist.
3	open the playlist from sergei chatschatrjan
3	open itunes and play kenny cox most popular concerto
3	play the gary chaw album
3	play me some grunge music
3	play chris goss on netflix
3	play the garden of allah  from wade mainer
3	play alles heeft ritme by liu tianhua.
3	play the best vanessa peters songs
3	play that stubborn kinda fellow by michael amott
3	play a 1983 concerto by ayaka on itunes
3	i want to hear dido from 1966 on youtube
3	play andy williams sings rodgers and hammerstein by elica todorova
3	play tujiko noriko's ten years and running.
3	open google music and play women of jazz playlist
3	play christian gangsta rap
3	play donald rubinstein on pandora
3	play shinya yamada music from 1962 on groove shark
3	play the greatest vimeo tunes by angelo amorevoli on soundtrack
3	play some google music.
3	open deezer and play top 40 hits
3	play me a nineties sound track
3	play a symphony that is good from 2000
3	play some music on pandora
3	play music from the twenties
3	play the most popular miles jones track
3	play miyavi's music from seventies on google music.
3	play a twenties soundtrack on youtube
3	play slow rock music
3	play some techno on lastfm
3	will you play me the most popular sound track from 2006
3	play the song i get ideas as performed by richard kruspe
3	play new track from the fifties
3	can you play an ep from the year 1958?
3	play scott la rock from stella on slacker
3	play thelma aoyama's latest concerto
3	make and play a new playlis with the theme songs released in 1968
3	play the tune by adam yauch
3	play some melody from the eighties on spotify
3	play music by mina caputo on lastfm
3	play some fifties music by origa.
3	play a popular gurdas maan track
3	play an album on netflix by chris castle from 2011
3	play the most popular music by ronald isley on google music
3	play the top-20 music by merz
3	play twenties music off of my itunes
3	play a mike osborne song
3	play groove shark
3	play me a maia hirasawa soundtrack from 1951
3	play elysium from ryan cayabyab
3	play matt walker tunes
3	play solange 2016 album
3	play a soundtrack by mike hindert on spotify.
3	play the top-5 sort of ballad music from 2012.
3	i want to listen to lastfm, play a drop of the hard stuff by joi chua.
3	play pop 2017 picks
3	play groove shark
3	i want hear some junior murvin off of youtube
3	i want to hear a top-50 track from takahito eguchi on google music
3	play 25 to life by paul riley on deezer.
3	play me some seventies music with a good melody
3	play an masaki aiba tune
3	play morning song
3	i want to hear a fourties ballad by luciano
3	play a good 1952 symphony
3	play hardcore music
3	play a top twenty symphony by bumble bee slim
3	play wait until tomorrow
3	play a music ballad from the sixties
3	play the top 1991 sound track
3	play the latest songs by larry gatlin on iheart
3	play me a bluegrass song
3	play a sixties song by classified
3	play monie love tunes on google music from 1984 from her song list
3	play pop
3	play a melody from elmer bernstein
3	i want to listen to my spain top 50 playlist on groove shark
3	play top-ten eighties song
3	play michael angelo batio
3	play a twenties concerto from roger taylor on deezer
3	play dj kentaro from the year 1994
3	play a twenties song
3	can you play me a track from the nineties?
3	play a song off get up offa that thing by doseone on last fm
3	play a movement fromthe eighties by nobuo uematsu.
3	play in every dream home a heartache by vincent paul abbott
3	play the newest released song from 1951
3	use slacker to listen to seventies music
3	play the best song by henry rollins.
3	play my melodious playlist
3	play top music from charles l. johnson on vimeo
3	play the top-twenty from tony calder off slacker.
3	play anything from the twenties
3	play music from 2012 by yossif kobzon on last fm.
3	play the theme tune that christian fennesz wrote
3	open youtube and play nanana from massimo altomare
3	open lastfm and play a voluntad del cielo from wax
3	i want to hear a 1957 theme song
3	play my electro sur playlist.
3	play the last track by shavo odadjian
3	play brotherhood by ock joo-hyun
3	play latest george ducas music
3	play a tune from 1962
3	play i could write a book
3	listen to acapella
3	play music from 2005 by justin broadrick
3	play the best 1981 sound track from ric fierabracci
3	play a ballad by owen pallett from the seventies on slacker.
3	play concerto from 1951
3	play yung joc on slacker
3	i want to listen to speed metal symphony
3	play journey list
3	play a melody by hagigat rzayeva
3	play fifties from sirusho harutyunyan
3	play a fairouz tune on deezer
3	play the top-twenty songs by the kleptones on spotify
3	play the greatest music you can find by ari herstand on zvooq
3	play 90s love songs on youtube
3	please play got the time
3	play twenties from ken floyd
3	play the playlist grime shutdown
3	play masashi hamauzu's newest symphony on itunes.
3	play the playlist funtime activity
3	play some seventies songs from luke haines off of youtube
3	play clay aiken's the bonny hind on groove shark.
3	play a song from helena iren michaelsen on spotify
3	play thirties music by flex on google music
3	play the good sort of 1992 theme music by layzie bone
3	play the last soundtrack from the sixties
3	play the latest ep from lobby loyde on netflix
3	play some dave pearce.
3	play track her majesty
3	i want to hear the newest music from the railway children
3	play short walk on a long pier on slacker
3	i want to hear vegetables by pharrell williams
3	play the album making evening and night by cevin key
3	create a theme station with jim creeggan records and collabs
3	open pandora and play reggaeton 2017 y baila!
3	play a martyn bennett from 1957 on pandora
3	play the mother lode by tamio okuda
3	play the top melody from artist maakii
3	play any album from the twenties
3	play me a song on pandora
3	play me a song by stephen jones
3	play a 1998 sound track  from sam the kid on last fm
3	play an ep by uncle jimmy thompson
3	play some game music.
3	play music from 2012 on netflix.
3	i want to hear a good song from 2016
3	play the playlist gypsy swing
3	play some grunge
3	play some sam moore.
3	play mikazuki sunset
3	play music on itunes from artist jessica delfino
3	open deezer and search for scott miller and play some of his new songs
3	play peja tunes
3	play a wendy carlos song from 2002
3	play a new song form the eighties
3	play the track titled faget
3	play the top song by jack grisham
3	please play jag vill leva i europa by porta
3	want to hear a chant by nellie mckay from the year 2008
3	play the top-ten chant doda songs from the twenties.
3	play sound track  music from the twenties
3	play some carmen mcrae from ed robertson off of itunes
3	play a song by fats waller
3	i'd like to listen to diana vickers best tune from the twenties
3	can you play any chant from the fourties?
3	play some music by daniel carter
3	play twenties on groove shark
3	play twenties symphony from robert walter
3	can you play a sonata
3	let's listen to the most popular marty friedman songs on zvooq.
3	play an album from the fourties
3	play me a xuefei yang symphony on groove shark
3	play soem nineties charles thompson
3	play some dance music
3	let's hear some tunes from the thirties.
3	play the seventies album on last fm
3	play music from lastfm and deezer.
3	play tã© para tres
3	play artist stu davis from the album dub chamber 3 on netflix
3	play music by ian haugland
3	play some drum & bass
3	play a symphonic rock on pandora
3	play the last theme by behzad mirkhani.
3	open netflix and play david frizzell
3	can you play crossover?
3	plya a tune by kancherla gopanna from 1951 on zvooq
3	play some fourties music on spotify.
3	play the album everybody happy by lee aaron
3	play the theme music from 1963 by yuki koyanagi
3	play groove shark folk-rock
3	play the album how insensitive
3	play some classical music on spotify
3	play used to love her by dara.
3	play me a twenties tune on deezer
3	play music by cass elliot
3	play concerto from the eighties
3	play on my own
3	play nick hexum latest album
3	play me a twenties song
3	play a ballad from 2000
3	play the sound track by ferry corsten
3	play a 2009 concerto on deezer.
3	play me some max martin on lastfm
3	play some sia furler on last fm
3	play the thirties soundtrack by ghader abdollahzadeh on youtube
3	play say a word by la india
3	play me a fifties song by chingy
3	play music from paul landers
3	play taiwan is good by kotoko.
3	i'm in the mood to listen to meditative music.
3	play hughie graham by vidyadhar vyas
3	give me an album from 1972 to listen to.
3	play some 1962 theme music.
3	play noctã¡mbulo playlist
3	play annet artani soundtrack on slacker
3	play the track the wizard and i
3	play crossroad blues.
3	play some amber kuo from the eighties on spotify.
3	i need to hear some music from spotify
3	play some sister rosetta tharpe songs from the eighties
3	play on spotify ms scandalous
3	play a twenties tune by jodie aysha.
3	play addicted to you by hank ballard
3	play tooh by eric bazilian on google music.
3	play music by keren woodward
3	play music by paulinho da viola from 1965
3	play sergei anatoljewitsch kurjochin's music on groove shark.
3	play the song little robin redbreast
3	play music from the artist irma pane
3	play an andy silvester sound track from the thirties on spotify
3	play the music of tupac shakur
3	play anything from the top-50 jeff irwin record off of itunes
3	play tina cousins from 1956
3	play the music genre synthpop
3	play me songs from 1955
3	use itunes to play dancing playlist
3	play movement music by monk boudreaux on youtube
3	play the best bruce ruffin music on youtube.
3	play some showtunes music.
3	play music from 2014
3	play there must be more to life than this
3	play suite sudarmoricaine by afi on itunes
3	play the top-twenty margaret becker songs with google music
3	play the new music from wilko johnson
3	play iheart tunes by neil finn
3	play some music on slacker
3	play the album shooting silvio by dave sabo
3	i want to hear music from carman from the 1966 album
3	play my fusion fest playlist on youtube
3	play 2004 guy sebastian on itunes
3	play vic ruggiero music from 2007
3	play all the way my savior leads me on spotify
3	play some nineties music on pandora
3	play fifties music
3	play some nineties eliza carthy
3	i want to hear sia furler's popular songs on last fm
3	play seaside by don cherry.
3	play record from the seventies
3	play any chant from 1973
3	play top tunes by joseph utsler
3	play southern rock tunes
3	play me some music youtube
3	play iheart
3	play igor nikolayev music from the fourties
3	please play songs by lil jon
3	play victoria banks's album
3	play a song by busta rhymes
3	play the album resurrection in blood from sleepy brown on itunes.
3	play fifties music by ahmed abdul malik
3	play the greatest record by joe purdy on google music
3	play some latin on zvooq
3	i want to hear the top 5 jamie lidell songs
3	i want to hear gothic rock on lastfm
3	play iheart
3	play wolves by larry gatlin
3	play that stubborn kinda fellow by michael amott
3	play long way to go by keita tachibana
3	play the most popular ep by marcel khalife on netflix
3	play album from maureen mcgovern
3	play music on deezer.
3	play music from 2000 on spotify
3	play the newest phil stacey.
3	play music on last fm
3	i'd like to listen to opera on youtube
3	play listen to the mocking bird by billy martin on youtube
3	can you play me something from the eighties on youtube
3	play spotify
3	play the top-fifty theme songs by dennis brown.
3	play a popular chant by brian epstein
3	play a chant from 1978.
3	play a song off the nicht sprechen album
3	play netflix ballad by mike shinoda that is popular
3	play isaac yamma slut
3	play joey fatone soundtrack tunes from google music from 1972
3	play music on pandora
3	play a record from 1950.
3	i want to the latest ballad from ira losco
3	play music from 1958.
3	can you play a 1967 soundtrack on slacker
3	play the last wellman braud album relaesd
3	play fifties movement songs by fabio on last fm
3	play my under the surface playlist.
3	play deezer top 20 by natasja
3	play a ballad by bob johnston
3	play the latest joan baez.
3	play the album qr iii by bobby bare
3	play les pauvres riches by pan mei chen.
3	play some 1987 edie brickell.
3	play my jazz brasileiro playlist
3	i'd like to hear cry baby cry by ally kerr.
3	play a top-twenty tune by noor jehan
3	open itunes and play bad attitude
3	do you have something like impossible is nothing by abderrahmane abdelli?
