0	add another song to the cita romã¡ntica playlist.
0	add clem burke in my playlist pre-party r&b jams
0	add live from aragon ballroom to trapeo
0	add unite and win to my night out
0	add track to my digster future hits
0	add the piano bar to my cindy wilson
0	add spanish harlem incident to cleaning the house
0	add the greyest of blue skies in indie espaã±ol my playlist
0	add the name kids in the street to the plylist new indie mix
0	add album radar latino
0	add tranquility to the latin pop rising playlist.
0	add d flame to the dcode2016 playlist.
0	add album to my fairy tales
0	i need another artist in the new indie mix playlist.
0	add to playlist i love my neo soul the name national treasure book of secrets
0	add the fire and the wind to my digster future hits playlist.
0	add caleigh peters to my women of country list
0	add children of telepathic experiences to the playlist named baladas romã¡nticas
0	add 9th inning to my bossa nova dinner playlist
0	i need another tune in my legendary guitar solos playlist.
0	add slimm cutta calhoun to my this is prince playlist.
0	add always to dena's baroque 50 spotify picks playlist.
0	add song to sleepytime
0	add an album to my list la mejor mãºsica dance 2017
0	add hey, johnnie cope, are ye waking yet to year in metal 2016 playlist
0	add the album to the psychedelic rock playlist
0	can you add esquivando charcos to my playlist entitled the piano bar
0	add wiktor coj to the sleep playlist.
0	incorporate time warp into my fairy tales playlist.
0	add this maksim tune to trad folk
0	add tune to my playlist eletro br
0	add this tune to my dinnertime acoustics list
0	add monsters this is prince playlist
0	add a tune in chill vibes
0	can you add a track to my spain top 50 playlist
0	put this album by mike tramp on deathcore
0	add ross the boss to laurie's listas de ã©xitos list
0	add some beatmaster v to the this is nicky jam playlist.
0	add paulinho da viola to my radio rock song list
0	add eef barzelay to my country coffeehouse
0	add this artist to queen playlist
0	add olga souza to virginia's femme fatale playlist
0	add an album by m g sreekumar to my laidback acoustic playlist.
0	add this album to my spotify orchestra cello playlist
0	i want to put goldy mcjohn on my rock party playlist
0	add this song to noreen's fresh finds six strings
0	a shawnna to the warm hearts feel good playlist.
0	add this tune to rock save the queen
0	add firehouse to my acoustic soul list.
0	add this david cole track to my totally stress free
0	add progress to my clã¡sica para todos playlist.
0	add the artist  tony thompson to my canta en la ducha playlist
0	add the artist to my this is mozart playlist.
0	add this track to downtempo beats
0	add quicksand to my valentine's day love playlist
0	add feel the passion to my this is kudai playlist.
0	add this song to my us latin top 50 playlist
0	put this artist in pachangueo total
0	add vl mike to my dcode2016 playlist
0	add how to my week end playlist
0	add norma jean to my pure rock & roll playlist.
0	add kirk hammett to calm down
0	add on with the show to my beast mode playlist
0	add kjetil vidar haraldstad to listas de ã©xitos
0	can you add xanadu to latin alternative music
0	add this track to krystal's piano 100
0	can you put this track onto the playlist the selektor?
0	my jazz for loving couples needs more push the button
0	add the album the martin garrix show to my playlist
0	add gina schock to workout twerkout
0	add this tune to cristina's endorphin rush playlist
0	add this tune to my it's a southern thing playlist
0	add ik tara to laundry playlst
0	add this tune to this is nicky jam
0	can you add something by the artist paul cargnello to my chill tracks playlist
0	add runaljod gap var ginnunga to ashlee's playlist titled forever country
0	put the orange and the green on los 40 radio ãxitos
0	add an album by liza oumarova to the steampunk playlist.
0	please add a song to ines's playlist called metal party
0	for playlist todo latino add absolutely sweet marie
0	add gn to night vibes
0	can you add blood on the face to the playlist called heartland country
0	the spring classical playlist needs partners in crime added to it.
0	add the artist tomohisa yamashita to the conexiones playlist
0	add written in red to my cleaning the house playlist.
0	add cordell mosson to my i love my neo soul list
0	add album to feeling blue
0	i want to put another album into the a peaceful rush hour playlist.
0	open my acoustic concentration playlist and play an entire album
0	add sonntag to my assassin's creed
0	i want more francis healy in the rockin' vibes playlist.
0	add gareth gates to my autumn playlist
0	add tune to sxsw fresh playlist
0	add track to todo latino
0	add to my verano list a song by andy lee
0	add song to my club hits
0	add this tune to my playlist titled uncharted 4 nathan drake
0	add 100% te ljubam to the hit remix playlist
0	put this album on totally alternative
0	put this album into becky's infinite indie folk playlist
0	add yuna ito to the hot rods & horror shows playlist.
0	add the artist ruby to my digging now list
0	add this tune to my it's a southern thing playlist
0	add the album to the top 100 country tracks on spotify playlist.
0	add this track to the classical music for smart kids playlist
0	add an album to corinne's beast mode playlist.
0	include the album by arthur rhames in urban poet
0	i need to add to the all things post starting with my favorites from the silence
0	add nothing fancy to meditate to sounds of nature playlist
0	add cj snare to my indie mim playlist
0	add ernie hawkins to the dubstep playlist.
0	please put this song onto my urban hits playlist.
0	add the spine surfs alone to my playlist called the funny thing about football is
0	add ajoy chakrabarty to women of country playlist
0	add this song to brooklyn beat
0	can you add some disco to my playlist called genuine r&b
0	add anthony hamilton to my list women of hip hop
0	add as i was going to st ives to the fantasã­a playlist.
0	put paula abdul on musica espaã±ola 2017
0	add the entity por una cabeza to my playlist forever alone
0	add track to afternoon train ride
0	add silver apples to teh sin estrã©s playlist.
0	please add this song to my llegando a casa palylist
0	add the song to the martin garrix show  playlist
0	add more david wolfenberger to my duetos playlist.
0	i want to add club mix to the playlist with the title 50 clã¡sicos
0	add eric bibb to country coffeehouse
0	add gregg bissonette to my us latin top 50 playlist
0	add track 70s smash hits to my
0	add this album to my blues playlist
0	i want this song on the playlist called chill vibes
0	add this adam clayton tune to sxsw fresh playlist
0	add this teddy charles album to this is pavarotti my playlist
0	can you add confessions to my playlist called clã¡sica
0	please add tobymac's song onto the indiespensables playlist.
0	add an album to playlist emily dickinson
0	add buddy desylva to my this is j balvin playlist
0	ad czarna dziewczyna to instrumental madness playlist
0	i want to add this song to my infantil playlist
0	add vera to my 80's jam session playlist
0	add a compilation of warped music ii to workout twerkout playlist
0	add a track to my list made in puerto rico
0	add this track to my epic wall of sound playlist
0	add michael lepond to electronic bliss
0	add angela au to the playlist radar latino
0	add artist abdel halim hafez to my conexiones playlist
0	add track  to this is puccini
0	i need to add a song to my lo que suena new york playlist.
0	add this artist to this is rosana
0	add joelia savitsjeva in 88 keys
0	add alain caron to my travelling playlist
0	add the r l burnside album to my nothing but a party r&b playlist
0	add steve jordan to inez's tgif
0	add to my playlist all funked up this track
0	add satisfied to my rockin' vibes playlist
0	add this artist named prince to the playlist all new all now
0	add billy strayhorn to my highway 61 playlist
0	add ramble on to halloween teens
0	add this song to rock party
0	i want to add lady maisry to my playlist lo que suena new york
0	i want to add an album to noreen's endorphin rush playlist.
0	add famous to my playlist lo que suena new york
0	add shawn camp to my soulful disco playlist.
0	add bonobo to queen playlis
0	add hold my liquor to electronow
0	add tobias sammet to my bring back the 90s list
0	add jack be nimble to my reggae bombastic list
0	add jan smit in endorphin rush
0	add rupee to my ultra metal playlist
0	please add liberty forever to the road trip playlist.
0	add gene clark to diann's chill out list
0	put another track in my electronica & dance playlist.
0	add the tune to the indie workout playlist
0	add david henry hwang to the this is nicky jam playlist.
0	add this jane olivor track to my the sleep machine waterscapes
0	i would like this artist on drum & breaks.
0	include dschiwan gasparjan in beth's rare groove playlist.
0	i'd like to add the artist jesper kyd onto my fresh electronic playlist.
0	add joplin in concert to my feel good dinner
0	add harry j to my dubstep dangles dirty
0	add partners in crime to joann's lo que suena los angeles
0	add this song onto hip hop gaming playlist
0	add this artist to my this is philip glass playlist
0	i want to put look to you on the playlist named 80s classic hits
0	add no secrets to power gaming playlist
0	add track to hit remix
0	add ali lohan songs in club hits
0	add this tune to retrowave outrun
0	add a track from the edge to my funk soul disco playlist
0	add hold tight to my throwback party
0	put do you love me on my acoustic soul playlist
0	add the name the 3rd world to the playlist rock me up
0	add this tune to my playlist named women of fresh finds
0	add tune to atmospheric black metal playlist
0	add sammy hagar to ultra metal
0	add 2120 south michigan avenue to my laundry playlist
0	add turk to the deep house playlist
0	add the name not fade away to the playlist the midnight hour
0	add the artist to the 90's baby makers playlist
0	add parempi mies to the cafã© con leche playlist.
0	place this tune onto my dinner for 2 playlist.
0	add exit to i love my 80's rollerdisco list
0	add darkest angels to my sos 48 2016
0	please put another tune into the laundry playlist.
0	add global underground 006 sydney to my best metal of the new millennium
0	add bslade to women of k-pop playlist
0	add a bill deasy track to the conexiones playlist.
0	add j j cale to my heavy gamer playlist.
0	add album to metal overload playlist
0	add the keep your receipt ep to my digster reggae playlist.
0	add country nights by a journal of the plague year to playlist
0	add ian gillan to my rock party
0	add paul young to my retrovisor
0	add nana tanimura  to a sudden rainstorm
0	add viktor tsoi to my sweet soul chillout playlist
0	i want glam added to the ntc gym strong playlist
0	add this ricardo villalobos track to under the surface
0	i want to add a song by w c clark to my nerding around playlist
0	add connee boswell to the relaxing playlist.
0	add nicole mitchell to my soul revived list
0	add artist to lo mejor de los 00's
0	this track should go on my evening chill playlist
0	add claudine longet to my ultimate 00s palylist
0	add a mina caputo album to my after hours party
0	put frank portman in my playlist good music
0	put this track from the edge on my funk soul disco playlist
0	add a jang nara track to the hip hop gaming playlist.
0	add kurious jorge to my synth pop
0	add songs in 90's hip hop of artist
0	add step to me to the 50 clã¡sicos playlist.
0	add this track to the sunshine reggae playlist
0	put this whole album on the playlist called old school metal
0	add de principii evangelikum to my domingo indie palylist
0	add back at the velvet lounge to my cleaning playlist
0	add hemanta kumar mukhopadhyay album in funky jams
0	add track to kickass metal
0	add song to my pop brasil
0	please add ruud jolie to my playlist guest list polygon
0	put this agent m tune onto de cantautor espaã±ol.
0	add this tune by kurt james to the playlist latin pop classics
0	include when i paint my masterpiece in my acoustic spring playlist.
0	add ths album to my pachangueo total
0	add repent replenish repeat to classical moments in movies
0	add this song to this is no te va gustar playlist
0	add 157 riverside avenue to leticia's animal humor playlist
0	add tune to composer weekly pauline oliveros playlist
0	add stuck on nothing to my sax and the city playlist
0	add armistead burwell smith iv to blues masters
0	add an album in my playlist in the name of blues
0	put united abominations onto my rare groove playlist
0	add lagaylia frazier to my emotron
0	i want to add a song by w c clark to my nerding around playlist
0	add a shot at glory  to calm before the storm
0	add this artist to the playlist called fusion fest
0	add song to my mellow beats list
0	add don and sherri to the electrosafari playlist.
0	can you put a song by jessica mauboy on my playlist entitled a sudden rainstorm
0	add m-cabi to the playlist named pre-party r&b jams
0	add a song to in residence metal hammer episode 6
0	add the stars and stripes forever to the soulful disco playlist.
0	add beijing huanying ni to my workday lounge playlist
0	i want to add a track to my evening groove playlist
0	add how to sos 48 2016 playlist
0	can you put dj kay slay onto the 2010 decade playlist?
0	add fabri fibra to evening acoustic
0	add this tune to escapada
0	add the unraveling to marina's playlist it's a southern thing
0	put this artist into my found them first playlist please
0	add stephen mcnally to confidence boost
0	add paul franklin to my the bachelor party
0	add a track to the another glass playlist.
0	please add a track by david freiberg to my workout playlist.
0	add this artist to my feel good dinner playlist
0	add vintage 74 to my mother's  primavera sound 2016 barcelona playlist
0	add an album by cowboy troy to my piano in the background playlist.
0	add hatfield and the north to my hot house playlist.
0	add tour generaciã³n rbd en vivo to the roadrunner rec new releases playlist.
0	i want global top 50 to have marit bergman added to it.
0	add the block brochure welcome to the soil 6 onto my cafã© con leche list
0	add paul wright album to 90s smash hits playlist
0	add an artist to my playlist this is verdi
0	add a tune to the this is animal collective playlist.
0	add this marilyn manson tune to latin party anthems
0	add dickey betts to my throwback thursday playlist.
0	add the album by cham to my cloud rap playlist
0	add atticus ross to the electrosafari playlist
0	add this artist to spain top 50
0	put lindsey cardinale into my hillary clinton's women's history month playlist.
0	add a gate through bloodstained mirrors to feelin' good playlist
0	put some frank ferrer into my edna st vincent millay playlist.
0	add madman to trap land playlist
0	add chas chandler to my aux cord privileges
0	put kan mikami on pre-party r&b jams
0	add let the season in  to my  lo-fi love
0	add this track to the 70s smash hits playlist
0	put any andrew hurley album onto timeless love songs
0	add be yourself tonight to i love my 90s hip hop
0	add track to my las canciones mã¡s lindas del mundo playlist
0	add this roy orbison song onto women of comedy
0	add artist to laundry
0	add a bum note and a bead of sweat to my stress relief playlist
0	add sara hickman to my targeted list
0	add jonathan arons to my indie electronics playlist
0	add track to my cloud rap
0	add this song to my playlist under funky jams
0	add mary wells sings my guy to the electro sur playlist.
0	add tune to soft rock playlist
0	add d-day dodgers to my running power playlist
0	i want a song by john schlitt in the bajo las estrellas playlist.
0	add vikku vinayakram to my this is nicky jam
0	add bossa nova soul samba to my jukebox boogie rhythm & blues playlist
0	add brad kane to the pumping iron soundtrack.
0	please add this song to indiespain list
0	add od mene se odvikavaj to my laundry
0	add this artist to dubstep
0	add the tune to your favorite slaughterhouse playlist.
0	add song to siesta
0	put lullaby of birdland onto fusion fest.
0	put sarah blasko onto my the metalsucks playlist
0	i want another track added to the korean osts playlist.
0	add cream to the funk playlist.
0	add take me back to dear old blighty to my dinner playlist
0	add this tune to the deep dark indie folk playlist
0	add this gisela song to my dancehall official
0	add histoire de melody nelson to my 90's baby makers playlist
0	add this tune to my road trip playlist
0	add tune to infinite indie folk
0	add album to ultra metal
0	i'd like to add this album to funtime.
0	add tune to punk espaã±ol
0	i want to add in the mood to my playlist called my folksy love
0	put this jerry dixon song onto my tokyo rising playlist.
0	add grim skunk to duetos
0	add jennie, jennie to my metal playlist
0	add dã­as felices to my todo reggaeton playlist
0	add candlelight to my house afterwork playlist.
0	add us placers to my new boots
0	add this track by clem burke to my atmospheric black metal playlist
0	add mayya to the de manhattan con amor playlist
0	add the nastya kamenskih song to my the martin garrix show playlist.
0	add artist to playlist epic gaming
0	add robin s to sxsw latin
0	put this tune onto the signed xoxo playlist.
0	add olympia 1959 to from the delta to chicago
0	the enamorã¡ndose playlist needs another album.
0	add song to rocksteady playlist
0	add funtwo to disco fever track
0	i'd like to add this album to my siesta playlist
0	add kevin cadogan to the 80s classic hits list
0	add the artist to my spooning playlist
0	add this alan wilson track to my this is luis fonsi playlist
0	for my playlist wild country add a great day for freedom
0	add ricky nelson to my classical x playist
0	add track to my playlist a sudden rainstorm
0	add ronnie james dio tune to women of electronic selection
0	add to isabella's club hits this song
0	include pat smear on guest list engadget
0	put a track by ricky martin into my 70s smash hits playlist.
0	add this track to my this is thomas rhett playlist
0	add i hate myself and i want to die  to my six string peacefulness
0	add yuna ito to my cena elegante playlist
0	please add jency anthony to my playlist this is mozart
0	put jtr on the top classical playlist
0	the get going playlist needs another song.
0	add munia the tale to my playlist called adrenaline workout
0	put molly and tenbrooks in the french n' heavy playlist.
0	add an album by twink to my classic country playlist
0	add the blurred crusade to crate diggers anonymous
0	add robyn hitchcock to my romantic evening playlist
0	add the beatles tune yesterday to my playlist, the southern highway chronicles
0	add enduser song in grime instrumentals
0	add koichi sugiyama to whm
0	put sungmin into my summer playlist
0	add little musgrave and the lady barnard to ora's punk rock workout playlist
0	i'd like to add this tune to my spotify orchestra cello playlist
0	add this michael v track to my folk & americana
0	add riddim driven engine 54 & humanity letha's all things post
0	add nana kitade to my modern psychedelia playlist
0	add the artist to the latin jazz playlist.
0	put ares in my canadian country playlist
0	add another tune to my songs for you, not your parents playlist.
0	add atticus ross to the playlist electrosafari
0	add tune to my hype playlist
0	add nib to fay's brooklyn beat playlist
0	add a tune to patrica's playlist, the rhythm
0	insert rock me up song to my list
0	add some martine mccutcheon to my original columbia jazzmasters list
0	add autry inman to my hanging out and relaxing playlist.
0	add the name the song about the towel to playlist piano in the background
0	add rock & roll to my playlist named night out
0	add tara blaise to my power gaming playlist
0	put this song on the chips and salsa playlist
0	add to my mac 'n cheese playlist with tså«zetsu
0	add country favorites willie nelson style to my playlist titled spinnin' records top 100
0	i want harris to be added to my latin dance cardio playlist
0	i would like to add something by kuk harrell to my hip hop 2017 new school playlist
0	shawn lane should be moved to my cena con amigos playlist
0	add dave carpenter to my acoustic blues playlist
0	add this track to the playlist named cali fire
0	put the artist pat monahan onto the emily dickinson playlist.
0	add splendido hotel to my verano forever
0	add this song to my novedades viernes sudamã©rica playlist
0	add a song by szahram nazeri to my playlist called this is jennifer lopez
0	add this track to new hip hop
0	add this is status quo to teddy riley
0	add the outlaw blues to the playlist with the title top 100 country tracks on spotify
0	add bring back my daddy to me to my playlist named might and myth power metal
0	add shangri-la to the african heat playlist.
0	add embryo to lessie's hands up
0	add best of uetoaya to wild country
0	i want to add kool keith to my chill out dinner playlist
0	add david axelrod to my futuros hits list
0	add artist to my endorphin rush playlist
0	add current album to my pop gaming playlist
0	i want if i could be with you added to mellow dinner
0	add spanish castle magic to daily lift
0	add little walter to women of comedy playlist
0	put a bunky green tune into the phunkadelic playlist.
0	put this tune on dancepop
0	add this karina album to my folk pop playlist
0	add a tune by louis wolfe gilbert to my cleaning playlist
0	please add a tune by kaori utatsuki to my korean osts playlist
0	add om to my classic punk
0	add this jimmy london tune to the new waltz playlist
0	add song to orgã¡nica
0	add bill evans to the motivation mix playlist.
0	add ray noble to my chill vibes playlist.
0	add this track to latin jazz
0	add this artist to cynthia's fresh finds
0	add giancarlo erra to my guitar hero live playlist
0	add this tune to my wine & dine playlist
0	add this tune to my rage radio playlist
0	add bad news to highway 61 playlist
0	put this tune on my playlist technical&brutal death metal
0	add the singer barbara to my country radio playlists
0	add tatico henriquez in my playlist called bleeps & bloops
0	add warpaint in my pre-party list
0	put this artist on domingo indie
0	add ian north to my autumn lounge playlist
0	add this tune to the leche con chocolate playlist
0	add to the rock games
0	i want to add something by the artist nadine to my workday â pop playlist
0	add radhae unakku kobam aagathadi to my women of metal playlist
0	add album to my classical essentials playlist
0	add teenager to the queen playlist
0	please put this artist on my indie mim playlist
0	add artist steve cropper to rhythm and blues
0	add dean martin track to metal xplorer playlist
0	put this song in the playlist trap land
0	add 3 natsu natsu mini berryz to my rock classics playlist
0	add nyoil to my this is prince playlist
0	add this tune to my list jazz vibes
0	add sp balasubrahmanyam to my rockabilly mania playlist.
0	add this album to my all out 70s playlist
0	add bob klose to la mejor mãºsica para tus fiestas
0	add song to zen focus playlist
0	add this tune by hart wand on this is wagner
0	add the da brat track to the soak up the sun playlist.
0	add roger nichols to punk rock workout
0	include laarni lozada on endorphin rush playlist
0	add francesco de gregori to gayle's women who dj playlist
0	add sarah vaughan to the spa treatment playlist.
0	add third stone from the sun to the concentraciã³n playlist.
0	add the artist cho kyu hyun to funky jams
0	i want to add aprite le finestre to my playlist entitled this is earth, wind & fire
0	add alexia to women of classical
0	put this track by tony bevilacqua into joan's playlist with the title women of folk & americana
0	add this album to my throwback party playlist
0	add nina hagen to essential folk
0	please add secrets of the alibi to the playlist called keep calm
0	add karin dreijer andersson in escapada album
0	add this ruth crawford seeger song to my playlist called the soundtrack 007
0	add jenifer to rock the 2000's
0	add josephine wiggs to my kickass metal playlist.
0	add the big mama thornton song to cassie's punk rock workout playlist
0	add artist to acoustic soul
0	add name house of gold to the de manhattan con amor playlist
0	add the song to my we everywhere  playlist
0	can you add this tune to the night out playlist?
0	add album to my party with friends
0	add i roy to my this is rosana playlist
0	add transmission to my found them first
0	the songs to sing in the car playlist needs k j yesudas discography in it.
0	add slave to the rhythm to the playlist massive soca hits
0	add intelligence and sacrifice to skatepark punks
0	for my playlist it's ok to like jazz add this tune
0	add chamberlain waits to my picnic in the park
0	can you please put this track onto my todo novedades playlist?
0	add totally stress free by bobby lord to my playlist
0	add shame on you to my masters of metal playlist
0	add cake to bake to lo que suena new york
0	add this song to the novedades pop playlist
0	add something by arnett cobb to my la mejor mãºsica para tus fiestas playlist
0	add young maylay to club hits
0	put this artist on my folk for kids playlist
0	put this track on my infinite indie folk playlist
0	add this track to duetos
0	add the album to rosanna's ejercicio playlist.
0	i want to add another album to the wine & dine playlist.
0	add artist to novedades pop
0	add please, please, please, let me get what i want to my crate diggers anonymous
0	go to cali fire and add refrain to my playlist
0	add bashful brother oswald to love moments
0	add a tune in women of classical
0	add pangaea to my gold edition playlist
0	add this track to anne's playlist named just smile
0	i'd like a new england added to classical moments in movies.
0	add this artist to the this is dirty projectors playlist
0	i want to add robin hood and queen katherine to my playlist entitled genuine r&b
0	ad i should have known better to this is bb king
0	add i dreamt of a dragon to my futuros hits playlist.
0	add hello central, give me heaven to indie pop
