5	show the blue meaning television show
5	find book the music lovers
5	show under the sea creative video game
5	can you get the tv show, enter the matrix?
5	find me the novel of a dictionary of slang and unconventional english
5	find the transformers: generations video game
5	find thyme travel
5	show movie crossgenesis
5	can you find me the restless natives?
5	find a saga called set sail the prairie
5	show that little band of gold
5	i need to find the work brotherly love
5	find a painting called the wipers times
5	look up the television show called monster mash
5	where can i view the trailer extreme – the collection
5	play the song memories are my only witness
5	please help me find the selections from the arista years video game.
5	please search for the work, wholehearted.
5	find chant down babylon: the island anthology
5	find becoming royston
5	show creativity of photograph of my wonderful day
5	show the family from one end street album
5	play me the saga the party’s over
5	i want to see the tv show cause & effect
5	i'd like to watch miss congeniality
5	find a man needs a maid
5	buy novel brokeback mountain
5	want to watch the tv show treeful of starling
5	show the man from london video game
5	find in the line of duty: street war.
5	find a soundtrack called the christmas shoes.
5	i'd like to listen to the song the natural farmer
5	show creativity of your body above me
5	find me the travel weekly
5	find a video game called new york 911.
5	find changes: a love story.
5	i want to see the tv series a state of mind
5	find me the spartan: total warrior painting
5	look up the reverse of the medal
5	find the love and war soundtrack
5	show movie schedule of the big mouth
5	find a photograph of adventure time: the secret of the nameless kingdom
5	find a song called this champagne mojito is the last thing i own.
5	i need work of father dearest
5	please find me the platinum box ii song?
5	find a television show called merced sun-star.
5	i'm looking for the television show titled justice league
5	i'm looking for the hit album, the politics of dancing.
5	search for the nations
5	find a book called the magic christmas tree.
5	show me the picture sex and drugs and jesus christ
5	find the tv series i build the tower
5	find a novel called episodi di sons of anarchy
5	please look up two more years soundtrack.
5	find a television show called happy trails
5	find the exile and the kingdom
5	i want to see the maximum trance picture
5	where to get painting of the man in the white suit
5	show me the atrocity exhibition
5	find a soundtrack called new religion.
5	find the picture ultima vi: the false prophet
5	search for the painting hess: a biography
5	find me the soundtrack called enter the chicken
5	play remains of the day
5	pull up the video game, apothecary rx
5	find the song tholireyi gadichindi
5	i'd like to see the paul murray live television show
5	find me a game called spaceball
5	show creativity of the greatest movie ever sold
5	look for the editor & publisher tv series
5	i want to watch escape the fate discography
5	look for the creative work meltdown – days of destruction
5	find trivial pursuit: america plays
5	show me the movie haunted spooks
5	looking for liberalism and the limits of justice
5	play me the trailer for gainesville daily register.
5	find the madwoman in the attic.
5	i want to play the video game the coyote kings of the space-age bachelor pad
5	find me the princess battles song
5	find journal of the society for american music
5	i want to find the show called fresh aire 7.
5	find the picture chorus line
5	what is marty stuart discography
5	search for man in a garage
5	show me it might as well rain until september
5	find a tv show called engaged to the unidentified
5	find a tv show called zen: the music of fred katz.
5	can you find me the painting titled across the line?
5	i want to listen to the soundtrack adobe digital editions
5	find a tv series called when harry tries to marry.
5	i want to play the game pesterminator: the western exterminator.
5	find young miss holmes
5	find the trailer for the spooky sisters
5	i am looking for the tv show titled catchphrase
5	find the song ticks
5	go to bioruby
5	find the garden of eden
5	need to find a creative work with the title sometimes the blues is just a passing bird
5	show the ancient art of war picture
5	find me. i am mariah… the elusive chanteuse
5	find the three little pigs television show
5	find an album called stumble.stop.repeat
5	what is party all night
5	can you find me a trailer for phineas redux?
5	get me information on the riverfront times
5	where can i find lonely hearts
5	show me the work not a little girl anymore
5	i'd like to hear the song in a reverie
5	find bells break their towers, a video game
5	i want to watch the television show symphony for solo piano
5	show me the painting called fool for love.
5	please find the album the party scene
5	where to buy book charlie countryman deve morire
5	search for the show champagne showers
5	show me the movie black summer
5	where can i find the show game of death ii
5	find a video game called craters of the sac
5	find an album called list of re: hamatora episodes.
5	where can i find the saga addicted to love
5	can you find me the movie, the girl and the general?
5	play the electrochemical and solid state letters song
5	find the show titled hell on earth 2006
5	can you search city of scars?
5	please look up the power and love movie.
5	find five spanish songs, a photograph
5	want to see the dungeons & dragons: chronicles of mystara
5	look up the this is halloween trailer
5	can you find me the movie the countess?
5	find the movie everywhere but home
5	where can i download the game miss robin hood
5	where can i buy the lying game
5	show the minutes to midnight photograph
5	show me the video game  when in rome 2007
5	please get me the national medical journal of india game.
5	where can i buy the movie the teahouse fire?
5	is the television show kamen rider ooo wonderful: the shogun and the 21 core medals streaming anywhere?
5	find back for good, a novel i want to read
5	can you help me find scholarmate?
5	find a painting called pulsions.
5	find a novel called kiss me licia.
5	i'm looking for the trailer of highlands today
5	find word of mouth for me
5	find me the lace and whiskey soundtrack
5	please search cardin in australia saga
5	find the tv series the parent trap iv: hawaiian honeymoon
5	find the novel the last of sheila
5	where can i purchase the tv show time for heroes
5	play the album journeyman
5	where can i locate the game legion of mary: the jerry garcia collection
5	please pull up nothing feels good
5	want a work called walk the river
5	find me recorder and randsell
5	can you find me the real mccoy novel?
5	find a photograph called sleeping with the enemy.
5	show olympia 81 saga
5	where is the creative work seven pillars of wisdom?
5	find a photograph called dragon ball z: the best selections
5	i want to watch the trailer ad nauseam
5	show creative last light
5	where can i find the trailer for sensations of 1945
5	can you find a creative work called a saintly switch
5	where to get album justified
5	find a saga called the devil went down to georgia.
5	where can i find the tv show of the school teacher in the house
5	i need to episodes for the tv series, fast food nation.
5	find the dressmaker.
5	where can i find the brave little toaster to the rescue book?
5	find long hello and short goodbye, a movie
5	find the mary van note show
5	where can i view the picture of workin’ with the miles davis quintet
5	where do i purchase the book, baby-sittor?
5	find a television show called sensation comics
5	find a picture called cahoots
5	find a trailer for pesterminator: the western exterminator
5	where can i purchase paradise tonight online?
5	i'm looking for the game called summer of fear
5	can you find a photograph entitled, beneath the harvest sky
5	find a novel called east liberty
5	find me a movie with the name oshin
5	show the singles collection volume 4
5	fine a movie called right here right now.
5	show the creativity of where what when
5	pull up the tv show, 40 seasons: the best of skid row
5	search for pat and margaret
5	show creativity of the game everything at once
5	where can i find the song red back fever
5	find the game endangered species
5	can you get me the all night long 3: the final chapter novel?
5	show the trailer of rugrats go wild
5	show me the saga the buffalo boy
5	there's a famous painting called thursday, do you have an image of it?
5	show me horton and the kwuggerbug and more lost stories
5	hook me up with a song by dancing girl.
5	where can i watch the latest episode of the tv show chu chu and the philly flash?
5	i want to play the video game international pinguicula study group newsletter
5	i want the show the sense apparatus
5	show the night riders
5	give me the spirit the earth aflame tv show.
5	please pull up the album, the last war
5	find a tv show called the fighting men
5	show creativity of adobe air
5	look for the american journal of sociology
5	search for the painting the elder scrolls i: arena
5	play another time
5	please search a new machine tv series.
5	look for the chu chu and the philly flash picture
5	show me the everybody wants you picture
5	play disney sing it! – high school musical 3: senior year
5	can i hear the song american high.
5	i need chapter one of the show, get it for me please.
5	i'm looking for a game called gateway
5	i want to listen to the soundtrack the om years
5	find the tv series truly fine citizen
5	find as live as it gets
5	plau me the song the french chef
5	find digimon next
5	i want to see the book, the mailroom: hollywood history from the bottom up
5	find the they came from somewhere else saga
5	find the putrid death sorcery soundtrack
5	i'd like to find the days of glory saga
5	find casting crowns discography
5	how can i watch the television show tinker bell and the legend of the neverbeast?
5	play tales from the organ trade
5	look for the itv.com song
5	search for the hills have eyes: the beginning tv show
5	help me find the work graphics animation system for professionals
5	find the show the demi-gods and semi-devils
5	find the show we chase the waves
5	where can i find a photograph of the lieutenant of inishmore?
5	can i see the album swat force?
5	can i see the the tv series the late music?
5	where can i view the photograph of johnny cool
5	show me a picture of nokia football crazy
5	go to the saga the quantum thief
5	can you find me the trailer of the hippocratic oath?
5	show me the painting called the descendants.
5	find the hundred-foot journey
5	find the movie chaos is me
5	show the phish: live in vegas tv series
5	show the matrix revolutions
5	i'd like to see level headed
5	find i could fall in love.
5	find me the book the van dyke show
5	find the tv series box of moon light
5	how to get saga stronda style
5	find me royal astronomy
5	find the magical world of roger whittaker
5	need find the book called hollywood connection
5	find the show portrait of countess karoly
5	help me locate a game called the master of ballantrae.
5	is there a program about the last flight?
5	i am looking for the creative work a wonderful life
5	where can i find the photograph of mr blobby
5	show me the album til the morning
5	find the video game the sims 3: generations
5	find the tyrant
5	please look up for disney universe.
5	show creative video game the boat is full
5	find a tv show called the soultaker.
5	show me the book the republican brain
5	i want to play the video game espn major league soccer
5	i'd like to see the saga tamagotchi 64: minna de tamagotchi world
5	show video game and the quality of life
5	where to buy education for chemical engineers
5	look for the book titled iranian journal of fuzzy systems
5	show the bridge of san luis rey picture
5	look for the learning & behavior picture
5	find if these walls could talk
5	find the novel what we did on our holiday
5	show panic in the streets
5	find a show called the paper route
5	find the video game tenacious d in: the pick of destiny
5	show the three tales album
5	find me the wild boys
5	please look up the lamentable journey of omaha bigelow into the impenetrable loisaida jungle television show.
5	find a trailer called eurythmics discography.
5	show force of nature
5	when is city of angels playing?
5	find a soundtrack called pax warrior
5	find history of north dakota, a tv series
5	i want to read the book between a rock and a hard place
5	can you find the tv show faithless street
5	buy cannabis painting
5	find live at bonnaroo.
5	play keep your right up song
5	show me firepower
5	please help me find the bloom: remix album song.
5	i'd like to see the picture the principle of hope
5	find sweet sensation
5	i need a book called student demonstration time
5	find resurrection of evil.
5	play the widow of saint-pierre saga
5	find me the album the weed tree.
5	find a video game called no parking on the dance floor.
5	where can i see the movie across the line: the exodus of charlie wright?
5	show me the television show the science of breath
5	find the news at seven-thirty photograph
5	search for tv show live at apollo
5	find a tv show called studies in logic.
5	find a video game called family dog.
5	find the song titled the mole show live at the roxy
5	what is just like in the old country
5	can you find the book beatmania iidx 10th style
5	find the cerebellum book
5	find a tv show called shake hands with beef
5	show the my world 2.0 photograph
5	play the game sugarfoot
5	search for movie turn back the clock
5	show creative video game name foros timis ston greco
5	find journeyman.
5	what is a romance of the halifax disaster
5	go to the photograph the inflated tear
5	i want to find the adventures of lomax.
5	show creative photograph named none of the above
5	show movie the skeptic – das teuflische haus
5	can you get me the education of little tree song?
5	i want to play a game called scotland tonight.
5	can you help me locate the game, coast?
5	where can i purchase the twenty chickens for a saddle saga?
5	look for a photograph of i wanna sex you up
5	show creativity of painting of me too
5	show creative photograph of icewind dale: heart of winter
5	what is the song the beast from 20?
5	find the little death, a soundtrack
5	play me the show cheaper by the dozen 2
5	i'd like to see the river of stars tv series
5	find a song called magic in the water.
5	show me god bless the child photograph
5	find stained glass windows.
5	find the game just dance greatest hits
5	find book in the valley
5	find the inspector for me
5	please search thirayum theeravum video game.
5	i want to play the game the carny
5	find wintersong game
5	can you get me the rakuen tsuihou: expelled from paradise television show?
5	find the movie yoshimi battles the hip-hop robots
5	where can i purchase the saga the second life of samuel tyne
5	how can i see the show pulse 2: afterlife?
5	play everybody wins trailer
5	play me the trailer for star control.
5	find pat garrett y billy the kid.
5	show saison 5 de game of thrones
5	play the what i need to do soundtrack
5	find the song the fourth man
5	find a tv show called frontiers in ecology and the environment.
5	find a tv series called church of the truly warped.
5	find a television show called the passion of the betty
5	where can i watch the television show the private affairs of bel ami?
5	find a book called screwed.
5	show he who fears the wolf creative photograph
5	find old school junkies: the album, a video game
5	find a novel called on the case with paula zahn.
5	find the game gormenghast
5	search for the complots
5	i'm looking for the pokémon: the movie 2000 tv show
5	find a tv series called all time greatest movie songs.
5	find dyskografia nick cave and the bad seeds.
5	find flesh and bullets
5	show me my princess
5	find join the dots: b-sides and rarities
5	find a world apart.
5	find the novel make peace not war
5	where to buy unarchigal
5	i'm looking for sherlock holmes contre arsène lupin.
5	please search for the work, all the wrong reasons.
5	show creative picture of wonderful town
5	search for television show windows live tv
5	find the rewind the film tv show
5	i want to listen to the album magical girl lyrical nanoha strikers
5	can you pull up the television show called electric boogaloo
5	find under night in-birth
5	read the black-body theory and the quantum discontinuity novel
5	show me the tv show my only wish
5	show creativity of sacred fire: live in south america
5	show creativity of book future of the past
5	find a saga called story of my life.
5	show tv show schedule of offroad legends
5	how do i see the tv series to see the invisible man?
5	find the life of riley, a photograph
5	find she monkeys
5	find do you wanna touch me, a song
5	show me chasing a feeling painting
5	please help me find i want to take you higher the game
5	find i love you too, a saga
5	i want to listen to the music of ghost in the shell: stand alone complex
5	i need a painting called brubeck plays brubeck
5	find manual of love 2.
5	find a show called ichibyōgoto ni love for you.
5	bombshells saga download
5	find a picture called ready.
5	show me the tv series prescription for death
5	i'd like to hear the soundtrack for just once in my life.
5	can you find my island home tv series?
5	show me a copy of the picture double deal.
5	i need a photograph of days of wine and roses and other tv requests
5	can you find the album simplescreenrecorder
5	look up the act of valor tv show
5	find a trailer called colony 7.
5	please find me a novel called the caledonian-record.
5	look for all broken up and dancing which is a video game
5	i want to listen to keep the faith
5	find phinally phamous
5	i need a photograph of the oregon desert
5	look for a terrible vengeance
5	i want to watch the tv show down on abby
5	find a tv series called manufacturing consent.
5	find the tv show hot air
5	find a novel called twins of evil.
5	where to buy video game of think fast
5	find the envoy of lucifer show
5	find me the big sean discography soundtrack
5	find a novel called best hits live: save the children speed live 2003
5	find the from the hut tv series
5	i'm looking for a picture of fresh air
5	find me the video game for your love.
5	show the day the earth caught fire movie
5	can you please get me come away with me show?
5	where can i find information on brats in battalions?
5	where can i purchase the game dancing in the dark: 10 years of dancing ferret
5	can you find the info wars saga
5	search for teenage mutant hero turtles: fall of the foot clan photograph
5	find the earth is a sinful song
5	look up the adventure of the blue carbuncle
5	find some of my best friends are...the piano players
5	please find the tv series back to bach
5	please look up the falls church news-press album.
5	show tv series schedule of gears of war
5	show me photoscape
5	i need to find the creative work wave
5	find the movie ircle
5	find the game company of heroes
5	i'm trying to find the final solution video game.
5	find a video game called the yellow claw
5	find an album called preminchi choodu.
5	find the return to grace saga
5	what channel does the television show the roxbox play on?
5	find me a game called thesis eleven
5	please get me the critical condition show.
5	i'd like to play the album clarke
5	where can i listen to the song the lost worlds of planet earth
5	she me the game called knowledge and decisions
5	what is the cheapest price i can pay for the dvd called the darkest cloud?
5	play the seamus heaney collected poems song
5	find the trailer for live at hull
5	find the fire in our throats will beckon the thaw tv show
5	can you please find me, journals?
5	find the collision in black painting
5	show a family torn apart tv show
5	play bliss torn from emptiness
5	what is the trailer for feel the passion.
5	find boyish story
5	can you find me the work titled, a little curious?
5	is it possible to find the book live in europe online?
5	find a book called environment and behavior.
5	play show of cissy houston
5	i'm looking for the television show titled the lonergan review
5	find a game called the guyra ghost mystery.
5	show me the caribbean blue television show
5	find a soundtrack called top gear australia.
5	search for innocence from hell
5	i'm looking for the movie white unicorn
5	look for the tv series the stars at saint andrea
5	i want to read the book crash landing
5	look for little computer people
5	find the photograph a little less sixteen candles
5	show creativity of official history of australia in the war of 1914–1918
5	find framing the early middle ages, a game
5	can you pull up the sanford herald
5	show gd&top painting
5	go to the television show nothing without you
5	please look for catch a falling star
5	find the deathsmiles ii soundtrack
5	show me the trailer for live phish volume 12
5	find a book called the polish bride.
5	find a saga called shame on you
5	find live at bearsville theater
5	find the show the naked gun
5	play closer to the sun album
5	find a photograph called wild cats on the beach
5	find earth moving.
5	find amanda palmer goes down under
5	i'd like to see the painting empire of two worlds
5	play me the trailer for chasing after shadows... living with the ghosts.
5	find me the picture the id
5	i'd like to see the movie the ooze
5	find the crucible of man: something wicked part 2.
5	please look up the novel, heroes of annihilated empires
5	find outback bound, a trailer
5	play the song evocation i – the arcane dominion
5	search for the show the caretaker
5	find friendship way
5	show creativity of night of the hunter
5	find a video game called victory march
5	find zorro the game
5	show me the photograph of minutes to midnight
5	find family feud novel
5	play me the soundtrack ready
5	i'm looking for dead at 21, the tv series
5	search for video game the sky is crying
5	wish to fins a television show called whole again
5	find american psychologist, a game
5	i need the game the aria music show
5	find a painting called mister whiskers: my favourite nursery rhymes
5	show me the trailer for the glades.
5	show creative video game in my own backyard
5	i'm looking for the show pulse 2: afterlife
5	i need to find best of the west rides again
5	show the philosophy and phenomenological research saga
5	i want the photograph of walt before mickey
5	find the sarah the teen princess game
5	i'd like to watch the trailer for as tears go by
5	search for police women of cincinnati
5	look for the game find another way
5	i'd like to see jacksonville daily progress saga
5	show me the photograph johnny cash: the complete columbia album collection
5	i'd like to find scriptures of the golden eternity tv series
5	find book called dreams and all that stuff
5	where can i find the novel meast
5	play video game manifesto of nevermore
5	can i see the show heroes of might & magic 4?
5	i'd like to see the television show best-of: design of a decade 2003–2013
5	find the loving spirit
5	find bal ganesh 2, a video game
5	find a video game called merry andrew.
5	can you get me the maldeamores saga?
5	i am looking for the work: nikki
5	find the coffin.
5	what does for all the wrong reasons look like
5	show the caveman television show
5	find tv series of noroi - the curse
5	where can i find a copy of i bury the living?
5	find a tv series called armageddon summer
5	give me a link to the saga called copper – justice is brutal
5	can you find the photograph titled so long self
5	find karol: the pope
5	i'd like to play the album beloved rogues
5	trailer of gate of thunder
5	play pirates of the caribbean online
5	find me the television show a city sleeps
5	find all about aubrey.
5	find a tv show called union.
5	where can i find thor meets captain america?
5	find the picture of the harsh light of day
5	looking for the photograph the crimson climax
5	please pull up the photograph entitled another period
5	find laserlight.
5	find a soundtrack called billboard hot r&b hits: 1981
5	show angels of iron television show
5	find the song titled the rivalry: red v. blue
5	i'm looking for the painting god must have spent a little more time on you
5	i want the video game two more years
5	find me the show girl soundtrack
5	please search the songs for the deaf video game.
5	find a picture called every little thing she does is magic.
5	what is the television show phil ochs: there but for fortune playing
5	i want sugarfoot
5	show me the live in whitby album.
5	look for the district 9 novel
5	show creativity of soundtrack iheartradio countdown
5	play the soundtrack for the lord of the rings: conquest
5	show an actress for the newest album.
5	find a novel called a perfect day.
5	i want to play the game guitar heaven ... the greatest guitar classics of all time
5	show the legend of jesse james novel
5	looking for kepler scientific workflow system
5	where to buy painting target practice
5	play off the ground
5	show me the advocate
5	i'd like to see the saga song of the saurials
5	find the black girl in search of god trailer
5	find a picture called nuclear blast all stars: out of the dark.
5	i'm looking for the cineexport painting.
5	please help me find the video game john michael montgomery discography.
5	show creativity of all for one
5	read the novel friend: the great legacy
5	find later that evening
5	i want the video game southwest riders
5	find the photograph the remix please
5	please get me the before crisis: final fantasy vii television show.
5	find me the jquery mobile tv show
5	find a video game called batman: the return of bruce wayne.
5	can you look up the galsoft linux tv series?
5	find remedial chaos theory, a soundtrack
5	play the tv series bet awards 2013
5	tv series for the thirty nine steps?
5	find a game called a very special christmas 7.
5	show creativity in all nudity shall be punished
5	find movie titled triumph of the spirit
5	please look up the painting, modern times.
5	need to find the soundtrack called fire in the valley
